{
  "trademark": "FFmpeg",
  "summary": "One-sentence summary shown on the appstore card.",
  "overview": "A few short paragraphs describing what the app does and its main features.",
  "description": "Long-form description for the product detail page.",
  "websiteurl": "https://ffmpeg.org",
  "screenshots": [
    "https://example.com/screenshot-1.png"
  ]
}
